{
  "approval_ref": {
    "hash": "f625710a5868089c3aeff79ad028bd90ce958dbe8c73337b35236b391081ef8b",
    "id": "AUT-APR-20261010043505227-5c2197",
    "path": ".sdlc/autonomy/approvals/AUT-APR-20261010043505227-5c2197.json"
  },
  "authority_assurance": {
    "mode": "audit_only",
    "receipt_ref": null,
    "source": "declared_cli_attribution",
    "verified": false
  },
  "checkpoints": [
    "contract.approve",
    "data.migrate",
    "data.rollback",
    "deploy.remote",
    "output.link",
    "pull_request.merge",
    "release.local",
    "rollback.verify",
    "story.claim",
    "story.complete-step",
    "sync.commit",
    "sync.pr",
    "sync.push",
    "task.start.confirm"
  ],
  "constraints": {
    "allowed_capabilities": [
      "code-review",
      "knowledge-base",
      "node",
      "repo-read",
      "repo-write",
      "test-runner"
    ],
    "allowed_environments": [
      "local"
    ],
    "allowed_tools": [
      "code-review",
      "knowledge-base",
      "node",
      "repo-read",
      "repo-write",
      "test-runner"
    ],
    "allowed_write_paths": [
      "/var/folders/3g/9t_h7zgn7mq6sbqdcdknc7ph0000gp/T/agentic-sdlc-finalization-certification-history-recheck-po01gu/docs/local-release/app"
    ],
    "budget_ref": null,
    "forbidden_actions": [
      "budget-extension",
      "destructive-action",
      "environment-change",
      "external-access",
      "external-publication",
      "gate-bypass",
      "global-install",
      "irreversible-migration",
      "new-tool-or-capability",
      "new-write-path",
      "production-access",
      "protected-branch-merge",
      "remote-deploy",
      "requirement-change",
      "scope-expansion",
      "secret-access",
      "security-privacy-compliance-decision"
    ]
  },
  "contract_refs": [
    {
      "hash": "d5a2462594d2d681e0d12870976a4a3d243eb7c9d165bd90bfc0b2abc92eeaac",
      "id": "CONTRACT-RECHK-A",
      "path": ".sdlc/contracts/CONTRACT-RECHK-A.json"
    }
  ],
  "created_at": "2026-10-10T04:35:04.094Z",
  "delivery_id": "LOCAL-RECHK-A",
  "delivery_kind": "local_release",
  "effective_level": "supervised",
  "expires_at": null,
  "extensions": {
    "approved_profile_hash": "10f24bea67e66b57b85e865a17d1cd74c16d8d626abb257cef2387831dae1e59",
    "exact_delivery_selection": true,
    "requirement_ids": [
      "REQ-RECHK-A"
    ]
  },
  "hash_algorithm": "sha256:stable-json:v1",
  "id": "AUT-RECHK-A",
  "kind": "delivery_execution_profile",
  "local_release_target": {
    "allowed_actions": [
      "build.local",
      "release.local",
      "rollback.verify",
      "test.run"
    ],
    "allowed_write_paths": [
      "/var/folders/3g/9t_h7zgn7mq6sbqdcdknc7ph0000gp/T/agentic-sdlc-finalization-certification-history-recheck-po01gu/docs/local-release/app"
    ],
    "destructive_actions_allowed": false,
    "environment": "local",
    "external_access_allowed": false,
    "production_access_allowed": false,
    "rollback": {
      "procedure": "Restore the previous governed local release snapshot.",
      "required": true,
      "verification_required": true
    },
    "root_path": "/var/folders/3g/9t_h7zgn7mq6sbqdcdknc7ph0000gp/T/agentic-sdlc-finalization-certification-history-recheck-po01gu/docs/local-release",
    "smoke_cwd": "/var/folders/3g/9t_h7zgn7mq6sbqdcdknc7ph0000gp/T/agentic-sdlc-finalization-certification-history-recheck-po01gu/docs/local-release/app",
    "smoke_tests": [
      "[\"node\",\"--version\"]"
    ]
  },
  "material_scope": {
    "acceptance_criteria": [
      "Observable evidence exists for RECHK-A."
    ],
    "budget": null,
    "capabilities": [
      "code-review",
      "knowledge-base",
      "node",
      "repo-read",
      "repo-write",
      "test-runner"
    ],
    "environment": [
      "local"
    ],
    "external_or_production_access": {
      "destructive": false,
      "external": false,
      "production": false
    },
    "objective": "Implement story-scoped changes on dedicated branches using the approved contract, tests, and knowledge base context.",
    "release_target": {
      "allowed_actions": [
        "build.local",
        "release.local",
        "rollback.verify",
        "test.run"
      ],
      "allowed_write_paths": [
        "/var/folders/3g/9t_h7zgn7mq6sbqdcdknc7ph0000gp/T/agentic-sdlc-finalization-certification-history-recheck-po01gu/docs/local-release/app"
      ],
      "destructive_actions_allowed": false,
      "environment": "local",
      "external_access_allowed": false,
      "production_access_allowed": false,
      "rollback": {
        "procedure": "Restore the previous governed local release snapshot.",
        "required": true,
        "verification_required": true
      },
      "root_path": "/var/folders/3g/9t_h7zgn7mq6sbqdcdknc7ph0000gp/T/agentic-sdlc-finalization-certification-history-recheck-po01gu/docs/local-release",
      "smoke_cwd": "/var/folders/3g/9t_h7zgn7mq6sbqdcdknc7ph0000gp/T/agentic-sdlc-finalization-certification-history-recheck-po01gu/docs/local-release/app",
      "smoke_tests": [
        "[\"node\",\"--version\"]"
      ]
    },
    "scope": {
      "contract_id": "CONTRACT-RECHK-A",
      "delivery_id": "LOCAL-RECHK-A",
      "delivery_profile_id": "AUT-RECHK-A",
      "requirement_profile_ids": [
        "AUT-REQ-RECHK-A-R1"
      ],
      "story_id": "ST-RECHK-A"
    },
    "write_paths": [
      "/var/folders/3g/9t_h7zgn7mq6sbqdcdknc7ph0000gp/T/agentic-sdlc-finalization-certification-history-recheck-po01gu/docs/local-release/app"
    ]
  },
  "material_scope_hash": "8dc184d217b431f89d4d498da76012ec70cdafbc2322867d449ff2cc438c13b5",
  "phase_levels": {},
  "profile_hash": "9367f452f6bb1a8c92932de63b8f54a160bfd14b1c46ecbcac89b168e8ffca69",
  "provider_bindings": [
    {
      "action": "release.local",
      "provider_id": "local-filesystem"
    },
    {
      "action": "rollback.verify",
      "provider_id": "local-filesystem"
    }
  ],
  "provider_bindings_hash": "ecfd23f81c4fcf02b316534f89295aa9a44d72cd29d44005cba79307970b0c9f",
  "pull_request_target": null,
  "requested_level": "supervised",
  "requirement_profile_refs": [
    {
      "hash": "1555ee5f009a2c1e88bdd92fcbf17d22e4c5bf8c022b12155974c8f2c74b1115",
      "id": "AUT-REQ-RECHK-A-R1",
      "path": ".sdlc/autonomy/requirements/AUT-REQ-RECHK-A-R1.json"
    }
  ],
  "schema_version": "delivery-execution-profile:v2",
  "status": "active",
  "story_refs": [
    {
      "hash": "05cff802f537c812ad069e40d0ad988cd15008e2520413429eb0c4bcabbaa326",
      "id": "ST-RECHK-A",
      "path": ".sdlc/stories/ST-RECHK-A/story.json"
    }
  ],
  "updated_at": "2026-10-10T04:35:05.234Z",
  "use_policy": {
    "close_on_terminal": true,
    "max_concurrent_runs": 1,
    "mode": "exact-delivery",
    "require_usage_receipt": true,
    "reusable_across_deliveries": false
  },
  "valid_from": "2026-10-10T04:35:04.094Z",
  "version": 2
}
