{
  "approval_ref": {
    "hash": "686e235b7809f34443a2563b9f623910a7d102bc9643c23e19aea768008f1f98",
    "id": "AUT-APR-20261010043309973-041c92",
    "path": ".sdlc/autonomy/approvals/AUT-APR-20261010043309973-041c92.json"
  },
  "authority_assurance": {
    "mode": "audit_only",
    "receipt_ref": null,
    "source": "declared_cli_attribution",
    "verified": false
  },
  "checkpoints": [
    "contract.approve",
    "data.migrate",
    "data.rollback",
    "deploy.remote",
    "output.link",
    "pull_request.merge",
    "release.local",
    "rollback.verify",
    "story.claim",
    "story.complete-step",
    "sync.commit",
    "sync.pr",
    "sync.push",
    "task.start.confirm"
  ],
  "constraints": {
    "allowed_capabilities": [
      "code-review",
      "knowledge-base",
      "node",
      "repo-read",
      "repo-write",
      "test-runner"
    ],
    "allowed_environments": [
      "local"
    ],
    "allowed_tools": [
      "code-review",
      "knowledge-base",
      "node",
      "repo-read",
      "repo-write",
      "test-runner"
    ],
    "allowed_write_paths": [
      "/var/folders/3g/9t_h7zgn7mq6sbqdcdknc7ph0000gp/T/agentic-sdlc-finalization-successor-delivery-Mtq0Is/docs/local-release/app"
    ],
    "budget_ref": null,
    "forbidden_actions": [
      "budget-extension",
      "destructive-action",
      "environment-change",
      "external-access",
      "external-publication",
      "gate-bypass",
      "global-install",
      "irreversible-migration",
      "new-tool-or-capability",
      "new-write-path",
      "production-access",
      "protected-branch-merge",
      "remote-deploy",
      "requirement-change",
      "scope-expansion",
      "secret-access",
      "security-privacy-compliance-decision"
    ]
  },
  "contract_refs": [
    {
      "hash": "150a3e25c4a69ea0ce795cb6be0ced775cfe2777ec741da140cc77020bf18dbd",
      "id": "CONTRACT-SUCCESSOR-2",
      "path": ".sdlc/contracts/CONTRACT-SUCCESSOR-2.json"
    }
  ],
  "created_at": "2026-10-10T04:33:05.659Z",
  "delivery_id": "LOCAL-SUCCESSOR-2",
  "delivery_kind": "local_release",
  "effective_level": "supervised",
  "expires_at": null,
  "extensions": {
    "approved_profile_hash": "6fb4cdc5d5144d6874bca560c6333760f025cd6c99c02975f32deac657caaa21",
    "exact_delivery_selection": true,
    "requirement_ids": [
      "REQ-SUCCESSOR"
    ]
  },
  "hash_algorithm": "sha256:stable-json:v1",
  "id": "AUT-SUCCESSOR-2",
  "kind": "delivery_execution_profile",
  "local_release_target": {
    "allowed_actions": [
      "build.local",
      "release.local",
      "rollback.verify",
      "test.run"
    ],
    "allowed_write_paths": [
      "/var/folders/3g/9t_h7zgn7mq6sbqdcdknc7ph0000gp/T/agentic-sdlc-finalization-successor-delivery-Mtq0Is/docs/local-release/app"
    ],
    "destructive_actions_allowed": false,
    "environment": "local",
    "external_access_allowed": false,
    "production_access_allowed": false,
    "rollback": {
      "procedure": "Restore the previous governed local release snapshot.",
      "required": true,
      "verification_required": true
    },
    "root_path": "/var/folders/3g/9t_h7zgn7mq6sbqdcdknc7ph0000gp/T/agentic-sdlc-finalization-successor-delivery-Mtq0Is/docs/local-release",
    "smoke_cwd": "/var/folders/3g/9t_h7zgn7mq6sbqdcdknc7ph0000gp/T/agentic-sdlc-finalization-successor-delivery-Mtq0Is/docs/local-release/app",
    "smoke_tests": [
      "[\"node\",\"--version\"]"
    ]
  },
  "material_scope": {
    "acceptance_criteria": [
      "Observable evidence exists for SUCCESSOR."
    ],
    "budget": null,
    "capabilities": [
      "code-review",
      "knowledge-base",
      "node",
      "repo-read",
      "repo-write",
      "test-runner"
    ],
    "environment": [
      "local"
    ],
    "external_or_production_access": {
      "destructive": false,
      "external": false,
      "production": false
    },
    "objective": "Implement story-scoped changes on dedicated branches using the approved contract, tests, and knowledge base context.",
    "release_target": {
      "allowed_actions": [
        "build.local",
        "release.local",
        "rollback.verify",
        "test.run"
      ],
      "allowed_write_paths": [
        "/var/folders/3g/9t_h7zgn7mq6sbqdcdknc7ph0000gp/T/agentic-sdlc-finalization-successor-delivery-Mtq0Is/docs/local-release/app"
      ],
      "destructive_actions_allowed": false,
      "environment": "local",
      "external_access_allowed": false,
      "production_access_allowed": false,
      "rollback": {
        "procedure": "Restore the previous governed local release snapshot.",
        "required": true,
        "verification_required": true
      },
      "root_path": "/var/folders/3g/9t_h7zgn7mq6sbqdcdknc7ph0000gp/T/agentic-sdlc-finalization-successor-delivery-Mtq0Is/docs/local-release",
      "smoke_cwd": "/var/folders/3g/9t_h7zgn7mq6sbqdcdknc7ph0000gp/T/agentic-sdlc-finalization-successor-delivery-Mtq0Is/docs/local-release/app",
      "smoke_tests": [
        "[\"node\",\"--version\"]"
      ]
    },
    "scope": {
      "contract_id": "CONTRACT-SUCCESSOR-2",
      "delivery_id": "LOCAL-SUCCESSOR-2",
      "delivery_profile_id": "AUT-SUCCESSOR-2",
      "requirement_profile_ids": [
        "AUT-REQ-SUCCESSOR-R1"
      ],
      "story_id": "ST-SUCCESSOR"
    },
    "write_paths": [
      "/var/folders/3g/9t_h7zgn7mq6sbqdcdknc7ph0000gp/T/agentic-sdlc-finalization-successor-delivery-Mtq0Is/docs/local-release/app"
    ]
  },
  "material_scope_hash": "3cc2e631405667628ee6b96ffc832c9cfa2025d8252813530a882d7ebc72e6f4",
  "phase_levels": {},
  "profile_hash": "f6d55663782987f2fdbc9c87e2a9a3ca8e6f8815b82ed614eea554c1df351827",
  "provider_bindings": [
    {
      "action": "release.local",
      "provider_id": "local-filesystem"
    },
    {
      "action": "rollback.verify",
      "provider_id": "local-filesystem"
    }
  ],
  "provider_bindings_hash": "ecfd23f81c4fcf02b316534f89295aa9a44d72cd29d44005cba79307970b0c9f",
  "pull_request_target": null,
  "requested_level": "supervised",
  "requirement_profile_refs": [
    {
      "hash": "27d2da846619dc36b4208b609af0be36d08df603527847ee6f9fd0abaa8f5128",
      "id": "AUT-REQ-SUCCESSOR-R1",
      "path": ".sdlc/autonomy/requirements/AUT-REQ-SUCCESSOR-R1.json"
    }
  ],
  "schema_version": "delivery-execution-profile:v2",
  "status": "active",
  "story_refs": [
    {
      "hash": "a3448b9c7b992befff5b9b40db1a89344b4b811a5ae193b1bf2dbff6d4a27aad",
      "id": "ST-SUCCESSOR",
      "path": ".sdlc/stories/ST-SUCCESSOR/story.json"
    }
  ],
  "updated_at": "2026-10-10T04:33:09.979Z",
  "use_policy": {
    "close_on_terminal": true,
    "max_concurrent_runs": 1,
    "mode": "exact-delivery",
    "require_usage_receipt": true,
    "reusable_across_deliveries": false
  },
  "valid_from": "2026-10-10T04:33:05.659Z",
  "version": 2
}
